name,season,number,airdate,rating,summary,image_url
Coming Home,8,4,1997-10-01,10.0,"Kelly moves back into the beach apartment. Noah advises her to concentrate on her relationship with Brandon. She follows his advice, but becomes frustrated when she still cannot remember her life with Brandon. Her memories finally return as she reads the first issue of Brandon and Steve's newspaper, The Beverly Beat. A designer offers to purchase Donna's work. As she walks out of the interview, she stumbles onto a sweatshop; a young girl has burned her arm while operating a steam press. Donna and Brandon decide to investigate the story. David manages a rock band and allows the lead singer to crash at the apartment. Donna is put off by the man's rude behavior, and overhears him making an anti-Semitic remark. Noah pushes Val away and admits that he is consumed by thoughts of another woman. Valerie follows him to a spot overlooking the city; he shares that his girlfriend died in a car accident at this location after Noah lost control of the vehicle. Wealthy client Cooper Hargrove shows an",https://image.tmdb.org/t/p/original//uTe07g6i2FY28eycnlY2coP5uK9.jpg
The Right Thing,8,5,1997-10-15,10.0,"Brandon and Donna discover that Rush owns the building that houses the sweatshop. Although Rush denies any knowledge of illegal activities, Brandon uncovers proof that he owns the clothing factory. Steve accuses Brandon of selling out his father to establish a reputation as an investigative reporter. The woman who spoke with Donna is fired, although she had not revealed anything. She decides to expose the miserable working conditions, prompting Steve to confront his father. Rush admits that he may have known what was going on, and promises to clean up his act. While conducting the investigation, Steve forgets a promise to take Zach to Magic Mountain. David and Donna are kept apart by their busy schedules. David's band, Cain Was Able, continues to behave unprofessionally and make prejudicial remarks. David's credit problems escalate. Kelly fails to identify the shooter from the police lineup. This infuriates Brandon, who is certain that he picked out the right guy. Valerie fills in for",https://image.tmdb.org/t/p/original//pNTimXOcE6sw2BTYIQkXKG5aZaW.jpg
Pride and Prejudice,8,6,1997-10-22,0.0,"Brandon becomes overly protective of Kelly and displays behavior that borders on the sociopathic. When a man accidentally bumps into Kelly at a movie theater, Brandon imagines gun shots and attacks him. Detective Woods tells Brandon that the guy who shot Kelly is in the hospital. Brandon arrives and learns that the shooter is the man that Kelly described; the guy Brandon identified is the driver, who has been arrested. Brandon makes menacing remarks to the shooter's dead body. David negotiates a record deal for Cain Was Able. Donna shows him the band's new song, which includes racial slurs and encourages white supremacy. The record company executive tells David to let it go, but he refuses to allow the band to perform a showcase at the After Dark. David fights with the band when it tries to take the stage anyway. Donna learns that Valerie stole all of her clients. She tries to get revenge by asking Noah to work at a party in the hopes that he will catch Val with Cooper. Valerie manages",https://image.tmdb.org/t/p/original//psQFiyf0XqUti4S7EnAUq6xXwJk.jpg
Toil and Trouble,8,7,1997-10-29,0.0,"An unenthusiastic Noah discusses his investment portfolio with a business manager. He covers by telling Valerie that the man was a boat owner. Val accepts an invitation to a ball from Cooper and tries to keep Noah away. He shows up to surprise her; both men get mad and dump Valerie. The building owner evicts David for failing to pay the club's rent. He steals a check from Donna and forges her name. Donna takes a job for a woman who she believes is the widow of a major fashion designer. The woman seeks her help in retaining a psychic to ask her dead husband about some hidden jewels. David angers Donna by skipping the ball. Steve escorts Carly to the event, although they have to leave early to tend to an ailing Zach. Kelly fears that she and Brandon are in a rut, so they do it at every conceivable opportunity.",https://image.tmdb.org/t/p/original//1HuJTFznJCVgfjjYRTpHUmQERYM.jpg
"Friends, Lovers and Children",8,8,1997-11-05,9.0,"Brandon and Kelly recognize a hooker on a downtown street as Dylan's sister Erica. They call Brenda and learn that Erica vanished after following a boyfriend from Hawaii to Los Angeles. Brandon pays a male prostitute to lead them to Erica, and he and Kelly move her into the house. After convincing Valerie that she can be trusted alone, Erica disappears with all of the gang's valuables. David turns to a loan shark for help with his money problems. Donna discovers that David forged her name on a check. Torn apart by David's deceitful actions, she dumps him and throws him out of the apartment. Steve feels uncomfortable when Zach tricks him into participating in a father-son soccer game. Steve apologizes to Carly for overreacting, and they spend the night together. A woman whom Steve dated over the summer shows up and claims that she is pregnant with his child. Noah refuses to accept Val's apology and resume their relationship. He gets very drunk and is arrested in a bar fight. Brandon bai",https://image.tmdb.org/t/p/original//i5cFrAz019uQ6Gd1pWmt058LF8d.jpg
Child of the Night,8,9,1997-11-12,9.0,"Erica is arrested for prostitution and released into Kelly and Brandon's custody. Brandon writes a story about her, but promises to leave her name out of it. The assistant district attorney needs the name of Brandon's source to build a case against Erica's abusive pimp. Despite Kelly's objections, Brandon insists on protecting Erica from possible retribution. Erica stands up to Riggs and helps a friend get off the streets. The assistant district attorney threatens to send Brandon to jail unless he cooperates. Jodi claims that Steve is the only man who could have possibly fathered her child. He tries to convince her to give the baby up for adoption. Carly persuades Steve to take a paternity test. Mel helps David file for bankruptcy and pay back Donna, but he still owes a large debt to the loan shark. Donna spends the day on her parents' boat with Noah while David moves out of the apartment. Valerie catches Donna and Noah kissing and shares the news with David. Sands' thug beats up David",https://image.tmdb.org/t/p/original//yQgIMu9eRzQewPMRGD42VqXKxSR.jpg
Deadline,8,10,1997-11-19,10.0,"Brandon is arrested for obstructing justice. Erica agrees to participate in a sting operation so that Riggs can be arrested on another charge without her testimony. Riggs gets busted for buying drugs from an undercover cop, and the police pretend to arrest Erica so that he will not suspect her involvement. Iris transfers custody of Erica over to Dylan so that she can live with her brother. A dedicated doctor impresses Kelly when she takes Erica to his hectic clinic. Kelly asks for a transfer to the clinic, where she will help with administrative duties. David moves into the office at the After Dark and accidentally starts a fire. He has lost his insurance and cannot pay for repairs, so the landlord terminates his lease. Donna takes pity on David and asks him to move back into the apartment. He takes her up on her offer, only to see her kissing Noah on the porch after a date. Valerie visits Sands and learns that Noah paid off David's debt. She lashes out at Noah for lying to her, and fo",
Friends in Deed,8,11,1997-12-03,10.0,"Dr. Monahan's behavior unnerves Kelly as he checks out her injured shoulder. Brandon insists that Kelly simply felt strange about being examined by an acquaintance, but she later finds reason to believe that Monahan was hitting on her. Kelly suggests that Brandon seek out talented columnist Emma Bennett for the Beat. The woman immediately begins coming on to him. Valerie warns Noah that he may be in over his head trying to manage the After Dark. He comes to agree with her and offers her a job, despite Donna's objections. Felice expresses her disapproval of Donna's relationship with Noah. Hoping to correct Felice's misconceptions about him, Noah buys the Martins' boat for $325,000 in an auction. David takes a job at a clothing store, but quits after just a few days. Donna sees David and Valerie at the mall and becomes jealous. Val suggests that they pretend to date to drive a wedge between Donna and Noah. Steve and Carly have difficulty finding time alone. Carly's mother stuns her by an",
Comic Relief,8,12,1997-12-10,10.0,"Dr. Monahan makes inappropriate advances toward Kelly. When she confronts him, he claims that he has done nothing wrong and accuses her of immaturity. Brandon lies about his whereabouts to Kelly and spends the day with Emma. They kiss after he drives her home. After discovering Brandon's relationship with Kelly, Emma tries to get to him by writing columns about the situation. David begins working at a car wash and befriends a gay teenage co-worker. He tries to convince the boy's parents to take him back, as he is sleeping at the car wash. David and Valerie proceed with their plan to make their exes jealous. Donna becomes upset and throws David out of the apartment, forcing him to move into Valerie's bedroom. Steve performs at the After Dark's comedy showcase. He initially bombs, but quickly recovers. He confesses to Carly that he stole all of the well-received material from Richard Belzer, and shares his history of stupid behavior.",
Santa Knows,8,13,1997-12-17,10.0,"Kelly considers filing sexual harassment charges against Monahan, but does not want to interfere with a fundraiser for the clinic. Monahan makes a pass at her during the event; Kelly talks with a supervisor, who warns that reporting him could cause future employers to label her a troublemaker. Brandon goes to Emma's apartment to pick up a column, and has sex with her. Wracked with guilt, he goes overboard trying to prove himself to Kelly. After Ben's parents reject his Christmas peace offering, he tells David that he plans to move in with an aunt and uncle. David realizes that he is lying and returns to stop him from slashing his wrists. He takes Ben back to the Walsh house, where Valerie convinces him not to give up on life. Ben's parents ask him to come home, and his father vows to try his best to accept him. Val and David realize how much they mean to each other. Noah upsets Donna by pushing her away during the holidays. Steve and a Santa-suit clad Nat help restore Zach's Christmas",
Ready or Not,8,14,1998-01-07,0.0,"Emma is upset to see Kelly wearing a watch that she had given to Brandon. Dr. Monahan forces Kelly out of the clinic. Emma suggests that she expose him, so Kelly turns on the intercom as Monahan makes another pass at her. Brandon barges in, and the foundation immediately fires Monahan, who will be replaced by Donna's father. Brandon asks Emma to leave the newspaper. She records a phone conversation in which he admits to sleeping with her, and uses the tape to blackmail him. Brandon and Steve hire a new assistant, Janet Sosna; and bring David aboard as a music reviewer. Donna is relieved when David reveals that his relationship with Valerie is a sham. David and Val get back together that day, and Donna plans to sleep with Noah as revenge. Noah nixes this idea, but then uses a private concert by Brian McKnight to get her into bed. Valerie cuts a deal with a bookie operating at the After Dark. Carly and Zach move in with Donna while their house undergoes some renovations. Zach inadvertent",
Illegal Tender,8,15,1998-01-14,0.0,"Brandon admits his affair to Steve. Steve suggests that they gauge Kelly's reaction by making her the advice columnist and having her respond to a letter about a similar situation. Steve intercepts a call from Emma; Kelly overhears and assumes that he is cheating on Carly. She lectures Steve and advises him to emulate Brandon. Kelly confronts Emma, who stuns her by playing the tape of Brandon's confession. A devastated Kelly breaks up with Brandon and orders him to leave her alone. A young singer accosts David for his scathing review, which resulted in her firing. David realizes that he misjudged her and helps her get a gig at the After Dark. Val buys David a new keyboard after he expresses a desire to return to music. Noah tries in vain to shut down Val's bookmaking operation. Duke sets her up with an undercover cop, and Valerie and Noah get arrested. Carly experiences a nightmarish day as she loses Zach at the mall. A kindly stranger drops off the boy at the security offices.

Music:",
The Elephant's Father,8,16,1998-01-21,0.0,"Kelly moves in with Donna and Carly. Brandon expects Kelly to immediately take him back and will not give her any space. He gets plastered, staggers over to the apartment, and yells at Kelly. He refuses to leave until she threatens to call the police. Donna gets upset with Noah when he defends Brandon and claims that Kelly should """"get over it."""" Brandon chases a minivan that cut him off and tries to attack the driver, a woman who has two children in the car. Noah realizes that Brandon has lost it, and apologizes to Donna. Valerie must perform community service at the clinic as punishment for her bookmaking arrest. Kelly smugly orders her around, so Val tries to get revenge by interfering with her relationship with Brandon. She tears up Brandon's messages and plays matchmaker for Kelly and an intern. Brandon shows up at the apartment late at night, but Kelly is not prepared to give him another chance. Carly's father suffers a heart attack and undergoes quadruple bypass surgery.",
Rebound,8,17,1998-01-28,0.0,"Valerie completes her community service, but not before arranging for Brandon to run into Kelly and Jeff during a date. A woman considers calling off her wedding to one of Steve's old frat brothers, and seeks refuge at the Walsh house. She bonds with Brandon over their fractured relationships, and decides to get married after all. Steve observes the couple's commitment to each other and realizes that he must get over Carly; he would have followed her to Montana if he had truly loved her. The keyboardist for Jasper's Law gets into a car accident while driving drunk. He claims that Noah is negligent for serving him too many drinks. David is aware that Mark had been smoking marijuana before the crash, but keeps quiet after Mark threatens to squash his songwriting deal. He finally shares the truth with the group leader, who fires Mark and replaces him with David. Donna loses her job when she stands up to a temperamental child model, but gets it back by dressing up like a clown. Brandon aga",
Crimes and Misdemeanors,8,18,1998-02-04,0.0,"David angers Valerie by moving out of her room and into Carly's old house. She apologizes for her behavior and arranges for a record company executive to watch Jasper's Law perform at the club. The group receives a new record deal, thanks in large part to David's song. Valerie believes that the song is about her, and is hurt to learn that David wrote it for Donna. Donna's grandmother must undergo surgery for an aneurysm. Donna introduces Noah to Mrs. Martin, but she still feels that David is Donna's soulmate. She requests a visit from David and asks him to look out for Donna. Mrs. Martin suffers heart problems after the surgery and soon dies. Val discourages David from attending the funeral, while Noah asks him to spend time with Donna because of their history. Donna and David share a kiss, but decide to remain friends. Kelly meets an ex-convict, who was sentenced to prison at age seventeen for murdering his mother's abusive boyfriend. She asks Brandon to write a story about the man to",
Cupid's Arrow,8,19,1998-02-11,0.0,"Valerie and Noah are not enthused when David's song receives radio airplay. They express their discontent at the amount of time David and Donna are spending together. David and Donna lie about their whereabouts before embarking on a shopping trip. They get into a car accident; Donna injures her back and begins popping painkillers. Val encourages Noah to reach out to his estranged half-brother, Josh. Valerie and Noah believe that their mates are cheating on them and become depressed. Noah gets very drunk, and Josh furtively slips something into Valerie's drink. After Josh is distracted by a phone call, Noah takes Valerie to the office and has sex with her. Val awakens in a daze and feels extremely ill, despite the fact that she had only one drink. David takes her to a doctor, where test results find Rohypnol (the date-rape drug) in her system. David and Valerie race over to the boat and accuse Noah of rape. Kelly spends a romantic Valentine's Day with Jeff. He expresses a willingness to",
The Girl Who Cried Wolf,8,20,1998-02-25,10.0,"Valerie presses rape charges against Noah. Kelly and Steve, citing Val's fake pregnancy and abortion, assume that she is lying in an attempt to extort money from Noah. David fights with Steve over his constant sarcastic remarks, and decides to move Val to his house. Donna believes that Noah is innocent, but pushes him away after learning that he did sleep with Valerie. The district attorney declines to file charges due to insufficient evidence; Val files a $10 million civil suit in the hopes of vindication. Josh proposes a $200,000 settlement without consulting Noah, who angrily withdraws the offer. Donna has difficulty keeping up with her work assignments because of her back pain and the effects of the painkillers. Josh supplies her with amphetamines, and she later steals drugs from her father's clinic. Brandon and Steve go on a ride-along with Steve's friend Tammy and her partner. Brandon believes that Tammy's partner used excessive force on a suspect, but decides not to write about",
Law and Disorder,8,21,1998-03-04,10.0,"Noah's civil trial begins. His attorney portrays Valerie as a golddigging tramp, and uses the gang's testimony to place Noah in a favorable light. Josh's testimony reflects very badly on Noah, and Val wins the case. Everyone apologizes to Valerie and turns against Noah. While rummaging through Josh's belongings in search of more pills, Donna discovers a prescription for Rohypnol. Josh admits that he drugged Valerie, and Noah offers to help Val build a case against him. David's record company experiences a shake-up. The new reprensentative forces Jasper out of the band and turns over all creative control to David. Jasper accuses David of treachery. Unable to meet her deadline, the disoriented Donna steals designs from a co-worker. Noah finds Donna passed out on her living room floor.

Music: """"This Ain't Going Away,"""" performed by Jasper's Law; """"Keep It Together"""" by Brian Austin Green",
Making Amends,8,22,1998-03-11,5.0,"The paramedics revive Donna; she returns home from the hospital quickly, but suffers from withdrawal. Donna is fired after confessing that she plagiarized her co-worker's designs. Noah helps her battle her addiction, and she forgives him for sleeping with Valerie. A teenager abandons her baby outside of the clinic. Kelly cares for the child and tries to convince his mother to take him back. When this fails, she turns the baby over to social services. Kelly decides to apply to become the boy's foster mother. Brandon discovers that the record company paid a radio station to put David's song into rotation. A girl is injured at a concert as fans rush the stage.  David quits the band and backs out of his record contract. Josh is sentenced to a year in jail for illegal drug possession. Valerie struggles to overcome memories of the rape and move on with her life. She concludes that neither she nor Noah is to blame for the crime. Steve finds love letters that are intended for another man.",
The Nature of Nurture,8,23,1998-03-18,10.0,"Kelly is upset when a gay couple receives custody of the baby. The teenage mother decides that she wants her son back, but only because she does not want him raised by gay men. Kyle and Gene give the child up without a fight, as they feel this is in his best interests. Kelly comes to believe that they would make better parents than she or Leann, and lobbies the girl to relinquish custody. She eventually agrees after realizing that she cannot care for the child properly. With the newspaper struggling to stay afloat, Steve accepts advertising from a cigarette manufacturer. Brandon becomes indignant and threatens to quit; Steve changes his mind by pointing out all the people he has helped through his writing. After a few dates, Steve finally tells Jill that he is not Ted (the man to whom she had been writing). She refuses to continue seeing him, and he vows to make her happy by finding Ted. David rediscovers his love of music by jamming with his neighbor, a washed-up guitar player who onc",
Aunt Bea's Pickles,8,24,1998-03-25,9.0,"During Valerie's surprise birthday party, Abby announces that she and Bill are engaged. Val and Kelly join forces in the hopes of getting their parents to call off the wedding. They eventually realize that Bill and Abby are happy and decide to support them. Bill disgusts Kelly by backing out of the wedding and leaving her to break the news to Abby. Valerie gives David further insight into her traumatic family history as she tells him that her father sexually abused her. Brandon receives a job offer from a major newspaper, but faces a dilemma when he learns that he is only being hired as a replacement for striking reporters. He returns to the Beat and suggests implementing a health plan for the overworked and underpaid Janet. Steve hesitates to introduce Jill to Ted; she decides that she really likes Steve and comes back to him. When Donna's dresses fail to sell, Noah tries to give her a confidence boost by buying the entire stock himself. She is angry when she uncovers the truth.",
All That Glitters,8,25,1998-04-01,9.0,"Brandon works on a story with a pompous Pulitzer-Prize-winning reporter. Kelly gets a developmentally disabled young man a position at the clinic, where he freaks out after making a minor mistake. Kelly convinces Brandon to let Chris join the reporter and him on the ice at a Los Angeles Kings practice, but Raitt leaves town to work on another story. Brandon helps Chris get a dream job at a friend's ice skating rink. In order to pay his taxes, David takes a job as a jingle writer. A ballad he had written for Valerie ends up in a deodorant commercial. Steve realizes that he and Jill have nothing in common. She dumps him before he has the chance to break things off. Janet has a crush on Steve, but he doesn't seem to get it. Donna discovers that the diamond jewelry that Noah gave her is fake.",
Reunion,8,26,1998-04-15,0.0,"The gang prepares for its five-year high school reunion. Andrea returns for the event; after initially pretending that her life is perfect, she reveals that she is divorcing Jesse. Brandon tries to convince her to work things out; but she has already tried every possible solution, even dropping out of medical school to spend more time with her family. Andrea does not want to speak at the reunion, so Brandon takes her place and delivers a speech with the theme """"it's okay to be yourself."""" Kelly becomes disgusted when Ross Webber, the guy who humiliated her after she lost her virginity to him, tries to exchange pleasantries. Valerie gives Ross a dressing-down and helps Kelly eradicate some old graffiti about her. Steve is upset that his classmates expect him to bring a bimbo to the reunion. Janet volunteers to be his date to help him change his image. He completely ignores her to chase after a beautiful classmate.",
Skin Deep,8,27,1998-04-29,9.0,"A """"sex shop"""" opens in Beverly Hills. Brandon, Steve and David patronize the store, under the guise of covering the controversy for the newspaper. Brandon infuriates Kelly by defending the store and its clientele, and attending a wild bachelor party for Muntz. A misunderstanding causes David and Val to fear that they are having problems with their sex life. Steve decides that he is interested in Janet after she expresses her philosophy on free love. Donna discovers that her assistant, who has very low self-esteem, calms herself by cutting her arms with a razor. She tries to convince her to seek help. Donna asks women of normal measurements to appear in her catalog because she believes that using models would send the wrong message. Kelly is revolted when Jackie opts to get a face lift and Erin frets about calories.",
Ricochet,8,28,1998-05-06,8.0,"Kelly finds it impossible to trust Brandon as he works late every night for several weeks. Brandon assures Kelly that he will never leave her and suddenly asks her to marry him. They experience doubts, but decide that they are ready for a lifetime commitment. Noah entertains Gwyneth, a longtime friend. She secretly has a crush on him, and kisses him on a ferris wheel. Noah insists that he is not interested in her. David becomes extremely jumpy after being robbed at an ATM. He gets drunk, steals a gun from the After Dark's cash register, and staggers into the alley behind the club. When Noah and Gwyneth try to stop him, he shoots at a dumpster; a bullet richochets and hits Gwyneth in the arm. Donna asks Gwyneth to stay at her apartment because she doesn't trust her around Noah. Valerie learns that she is a match for a leukemia patient in need of a bone marrow transplant.",
