name,season,number,airdate,rating,summary,image_url
Snowbound,6,18,1996-01-17,10.0,"Kelly reunites with Colin and spends all her time getting high. The couple becomes consumed by its habit, especially when supplies run low. Valerie realizes that Kelly is using drugs, but has difficulty convincing everyone else. During a jog, Susan breaks down in tears after she and Brandon pass the scene of a hit-and-run. She reveals that her older sister was struck by a car and killed while jogging with Susan. Donna's concern for Joe's health grows when he intensifies his training sessions. Brandon has a talk with Joe, and is angry when Susan wants to run a story about his condition. Susan fears that Joe's life could be in danger, while Brandon doesn't want rumors to affect Joe's chances at a pro career. Joe nearly collapses with an irregular heartbeat while running the stadium steps. Clare challenges Steve to a race after he belittles her new sports car. A cop pulls them over, and they must attend traffic school. A fellow student, impressed by their bickering, asks Steve and Clare t",https://image.tmdb.org/t/p/original//wv8tEaaVpLf4TTlu19WzGNrt1r0.jpg
Nancy's Choice,6,19,1996-01-31,10.0,"Susan is nominated for a college journalism award for her story about a girl's decision to have an abortion. Brandon does not understand why Jonathan insists on flying in for the awards ceremony. Susan explains that she and Jonathan broke up over a difference of opinion regarding the story; this further confuses Brandon. Susan wins the award and bursts into tears during her speech. She confesses to Brandon that the story was about herself; devastated by her sister's death, she had a drunken encounter with Jonathan and wound up pregnant. Jonathan proposed to her, and was crushed when she chose to terminate the pregnancy. Jonathan offers Susan his forgiveness, although she still has doubts about her decision. Valerie arranges a meeting between Colin and a knowledgeable art buyer in the hopes of encouraging Colin to get clean and focus on his career. Unfortunately, the man purchases two works that Colin had painted while high. Kelly swears off cocaine, but cannot resist temptation for lon",https://image.tmdb.org/t/p/original//v8U0i7vZkHLaHgj2SKQSkKIfJuk.jpg
Flying,6,20,1996-02-07,9.0,"Valerie's really annoying friend Ginger returns to town. She forces Val to put her up at a hotel and pay for room service and new dresses. Ginger blackmails Valerie, threatening to tell everyone about the previous fall's scam unless Val coughs up $50,000. She later changes her mind and demands a night with David instead. Clare and Donna confront Kelly after finding drugs in the apartment. She seeks refuge with Colin, and doesn't show for the girls' rummage sale. Brandon takes Kelly for a ride and refuses to drive her home until she has come to her senses. She steals his car when he pulls over to call Susan, then returns to the apartment and tells Donna that she is moving out. Brandon, Steve and Joe accept Jonathan's invitation to go flying in biplanes. Joe faints after his flight, prompting more concern about his heart. He agrees to another appointment with Dr. Martin.",https://image.tmdb.org/t/p/original//biKYdndIHqMqCkX9c5vmGHDX773.jpg
Bleeding Hearts,6,21,1996-02-14,10.0,"Kelly and Colin argue because she used their entire coke stash. She goes to see his dealer alone, and a second man nearly rapes her. She hits him in the head with a wine bottle and drives away. Kelly calls Brandon for help; he finds her trembling in her car. Brandon and Jackie get Kelly into a rehab center. She confesses her love for Brandon, who does not reply. David writes Val a special poem for Valentine's Day. Valerie tries to pacifiy Ginger (and help out Susan) by setting her up with Jonathan. They pretend to be a couple in the hopes of making Susan jealous. When Jonathan tries to trick Susan into entering a dance contest with him, she punches him in the face. Valerie tells David about her scam with Ginger, and asks him to save her from humiliation by spending the night with Ginger. Nothing happens between David and Ginger, but he dumps Valerie because he feels betrayed by her request. The football coach kicks Joe off the team and recruits a new quarterback. Donna stops Joe from q",https://image.tmdb.org/t/p/original//fY3iSOhfhY7wu9Lv3YRyIEhwZ13.jpg
All This and Mary Too,6,22,1996-02-21,7.0,"Colin visits Kelly and announces that he has kicked his cocaine habit. Kelly maintains that they are bad for one another and breaks up with him. Kelly gets a roommate, a troubled teenage runaway named Tara. Valerie has the house to herself as Steve and Brandon leave for a ski weekend with Clare, Susan and David. She hooks up with Colin. Susan challenges Brandon to a ski race, and they leave the designated runs. Susan injures her ankle on a jump, and the duo must fight the elements while awaiting a rescue team. Depressed by his split with Valerie, David mopes around the lodge. Everyone keeps introducing him to blonde girls named Mary. Donna hears news of a medical breakthrough that could save Joe's career. She must convince Joe to pursue the treatment (he doesn't want to get his hopes up), and goad her father into using his connections to Joe's benefit.",https://image.tmdb.org/t/p/original//f2cspALk2Us0bUTSi7X1QKrEG8o.jpg
Leap of Faith,6,23,1996-02-28,9.0,"Brandon and Susan spend the weekend at her parents' house. Susan's mother asks Brandon very intrusive questions during dinner. Mrs. Keats expects Brandon to sleep in the guest room, but Susan sneaks him into her room during the night. Mrs. Keats catches Brandon in bed with Susan the next morning. She expresses her disappointment, and Susan shares her frustration at the expectations placed upon her since her sister's death. Kelly befriends Tara. Colin and Valerie's new relationship upsets David and Kelly. Val orders David to mind his own business. Colin's old dealer, Danny, tempts him with some cocaine. Colin agrees to drive him to a drug house in Torrance. When the police arrive, a panicked Colin drives off and leads them on a high-speed chase. The gang watches the chase unfold on television, and is shocked to see that Colin is the driver. Joe's older brother Hank comes to town and tries to discourage him from undergoing surgery. Donna suspects that Hank is jealous of Joe's potential t",https://image.tmdb.org/t/p/original//ncR964vKeLHccLivX6RPwZoyIf.jpg
"Coming Out, Getting Out, Going Out",6,24,1996-03-13,10.0,"Valerie puts the club up as collateral to bail Colin out of jail. She also offers to spring for a high-priced attorney, as the public defender wants to plea bargain. Colin is terrified by the thought of spending time in prison. Kelly comes home from rehab and receives a surprise call from Colin. Donna is put off by the frequent phone calls from a lonely Tara. Tara runs away from the center. Kelly and Donna pick her up and give her refuge for the night. A medical student asks Kelly on a date. Clare and Susan resolve to reunite Nat and Joan, who have broken up because their relationship lacks its past magic. Clare, Susan, Brandon and Steve organize a romantic evening for the couple. They take them to many of the places that were special to them in 1971 and help them recapture their passion. Joe undergoes successful surgery and plans to return to football.

Music: """"Time of the Season"""" by the Zombies (#3, 1969); """"At Last"""" by Etta James",https://image.tmdb.org/t/p/original//gErZjEAnbXBwkGdOGJ53jrDp2bf.jpg
Smashed,6,25,1996-03-20,10.0,"Rush dumps Ryan and Austin off on Steve on the same day that he is hosting a fraternity party. He doesn't keep a close eye on the boys, and they drink everything in sight. Ryan becomes very ill and Greg (Kelly's med student date) diagnoses him with alcohol poisoning. He has to be rushed to the hospital, and his father blames Steve. Kelly invites Tara to stay with her after she finishes her stint in rehab. Tara becomes enraged when Kelly dates Greg, as she wants all of Kelly's attention. Colin's lawyer recommends that he plead guilty in exchange for a short sentence at a minimum security facility. Valerie persuades him to take the deal. Val goads Colin into attending Steve's party, but bristles when he shares a tender moment with Kelly. Donna and David videotape the party for a late-night campus program called C.U. Later.",https://image.tmdb.org/t/p/original//2syxjtLwGsrpkjFp0CI7IvBTaWG.jpg
Flirting With Disaster,6,26,1996-04-03,9.0,"Brandon, Steve and Joe go on a camping trip with Susan, Clare and Donna. The girls become jealous when the guys repeatedly ignore them to help some damsels in distress. Clare, Donna and Susan offer shelter to the tentless girls, and make their boyfriends sleep in the car. Kelly feels guilty about leaving Tara alone to go bowling with Greg; she convinces David to make it a double date. Tara sabotages Kelly's relationship with Greg. Valerie tries to arrange a truce between Colin and his estranged father, an artist who lost his sight in Vietnam. Colin is afraid to reveal his legal problems, but Mr. Robbins already knows the truth and has come to offer his support.",https://image.tmdb.org/t/p/original//ugDROvOhMd0FZtaCquN3jOeU7si.jpg
Strike the Match,6,27,1996-04-10,0.0,"Kelly tries to coax Tara into moving out, as the hospital has found her a place to live. Tara retrieves some belongings, including her photography equipment, from a friend. Kelly does not realize that Tara has a gun in her suitcase. After Kelly speaks of her hatred for Valerie, Tara sneaks out during the night and keys """"Die Val"""" on the side of Valerie's car. Val believes that Kelly is responsible, while Colin gets into a fight with David (who had earlier given him a lot of attitude). Tara freaks everyone out by copying Kelly's hair style and color. Donna and David film a music video for an up and coming band. Donna must appear in the video after the female star fails to show. Joe is unhappy to see her dancing around in a revealing outfit. The Boston Globe offers Brandon a summer internship and chance at a great post-college job. He rejects the offer because he and Susan had already planned a cross-country trip for the summer.",https://image.tmdb.org/t/p/original//p0f1bOJBnLQNQRnyV9J4VJvIEZR.jpg
The Big Hurt,6,28,1996-05-01,0.0,"Tara makes a pass at Brandon and purposely overfeeds Kelly's fish. Kelly orders her to move out. Kelly snoops in Tara's suitcase and discovers that she had lied when she claimed not to know her parents' whereabouts. Kelly enrages Tara by calling her parents. Tara holds Kelly at gunpoint and forces her to go for a drive up the coast. Kelly tries to escape when they pull over, but Tara knocks her out. She ties up Kelly, hooks a hose up to the car, and plans to kill Kelly and herself through carbon monoxide poisoning. Kelly tricks Tara into untying her, then gets the gun away. Tara is admitted to a psychiatric hospital, and her mother thanks Kelly for saving her life. The judge nixes the deal between Colin's lawyer and the district attorney. Citing the fact that he endangered lives with his hazardous driving, he sentences Colin to two years in prison. Carl, a prince and longtime friend of Clare's family, comes for a visit. He makes friends with Steve and tries to prove that he is not the",https://image.tmdb.org/t/p/original//AjOyf0HxnmhKce1jyIF3owHpTB5.jpg
Ticket to Ride,6,29,1996-05-08,10.0,"Colin tries to remain strong as he prepares to turn himself in and begin his prison term. He panics after catching a glimpse of some fellow inmates, and drives away in Val's car. Valerie must track him down or forfeit her $100,000 bond, which she acquired by cashing in the club's equity. Colin stops by Kelly's apartment in search of help, but she turns him away. When Valerie asks Kelly for information about Colin, Kelly acts really bitchy and denies having seen him. Brandon and Susan lose a five-thousand-dollar lottery ticket, leading to a major argument. They find the ticket, but give the money to charity because they feel guilty about fighting over money. Joe expresses disappointment at his slow progress as he returns to training. He realizes that he has lost his passion for football. Clare feels uneasy about Steve's friendship with Carl. Steve falls down the stairs and suffers a broken jaw.

Music: """"Be My Lover"""" by La Bouche (#6",https://image.tmdb.org/t/p/original//mWXHYQJHdGP0Mlvy1agwijlQ37.jpg
Ray of Hope,6,30,1996-05-15,10.0,"Kelly agrees to help with the search for Colin when Brandon reveals that Nat could fall victim to the bail bondsman through his business ties to Valerie. Kelly gets in touch with Colin after obtaining his beeper number from Danny. She arranges a meeting and contacts the cops, but Colin realizes that something is amiss and sends Danny to the rendezvous. Donna balks when she and David are asked to produce a music video for Ray. Ray asks for a chance to prove that he has changed. Donna accepts the project after meeting Ray's fiance, Wendy. Joe decides to quit football and take over as coach at his high school in Pennsylvania. He asks Donna to marry him. She turns him down because she fears that she would regret sacrificing her dreams. Clare is drawn toward Carl as they share memories of her mother. Mrs. Arnold believed that Carl would one day marry Clare and make her a princess.",https://image.tmdb.org/t/p/original//zCzFNBtOnyDoApTg9siXhZBhjeh.jpg
You Say It's Your Birthday,6,31,1996-05-22,0.0,"Colin plans to board a ship and sneak out of the country. He convinces Claudia, his former art dealer, to wire him the $10,000 passage fee. Valerie seeks Jonesy's help to track down Colin, and he sends her a handsome FBI agent. Carl throws Steve a huge 21st birthday bash aboard the Queen Mary and invites all his friends. Andrea surprises Steve by flying in for the party. David and Donna put together a video birthday greeting from friends and relatives who couldn't make the party. They send an inquiry to Brenda's address (she is actually on tour in Scotland), but receive a reply from Dylan. David helps Donna fight off the advances of their lecherous boss. She cools him off by revealing that she is a virgin, and he decides to hit on Kelly instead. Susan receives a chance to work on the presidential campaign. Brandon does not want her to go, and reminds her that he turned down his newspaper job in favor of their summer trip. Joan feels under the weather as she and Nat attend Steve's party",https://image.tmdb.org/t/p/original//xPYjktGdiwOnInZVqULWNhHifCH.jpg
Remember the Alamo,7,1,1996-08-21,10.0,"Steve attends the Olympics with Brandon, who spent most of the summer travelling alone. Their car breaks down in Hadley City, a small town in Texas. Steve decides to catch a bus to Houston and fly home to surprise Clare. He discovers that Clare has already left for San Antonio to surprise him. He flies back to San Antonio; thanks to a weather delay, they are able to find each other. Brandon meets a young black woman, who quits her job as assistant librarian after her boss hassles her for talking to him. Brandon's friendship with Mariah riles many of the townspeople; they have confrontations with two redneck mechanics, and her ex-boyfriend and a cohort. Mariah decides to move to New York and write a book about angels. She thanks Brandon for encouraging her to change her life. David constantly criticizes Donna as they try to complete a video shoot with a temperamental singer. Their boss is fired, and David panics at the prospect of losing his contract. Donna ends the partnership after le",https://image.tmdb.org/t/p/original//glS09BYaaO1I2pDWAXMP5g5B9ji.jpg
Here We Go Again,7,2,1996-08-28,0.0,"The Beverly Hills Beach Club holds its annual reunion. Steve reminisces about his relationship with Kelly, as he lost his virginity to her on the beach in 9th grade. Clare is disturbed to learn of the couple's history, and comments on the """"incestuous"""" nature of the group. Steve confesses that he spread rumors about Kelly after their break-up, causing her to gain a reputation as a slut. Kelly is hurt, but eventually decides to forgive him. Ryan blows a chance at a date when Austin convinces him to spy on the girl as she undresses. Steve gives the boys a lecture about treating women with respect. David continues to dump all over Donna for quitting the music video business. He harasses her when she talks and dances with another guy, and they decide to break up. Kelly goes to work at an AIDS hospice to complete her summer school credits. Mark Reese, the general manager of the campus television station, recruits Brandon and flirts with Kelly.",https://image.tmdb.org/t/p/original//phWp9JYiDmWmArmJELpfhZb867l.jpg
A Mate for Life,7,3,1996-09-04,10.0,"Joan's daughter Lily comes to town to serve as maid of honor, and seduces best man Brandon. Nat, Brandon and Steve discover that Lily is an exotic dancer. Nat and Joan's wedding comes to a halt when she goes into labor. She refuses to have the baby until she is a married woman, so they tie the knot in the hospital hallway. Joan gives birth to a son, Frankie. Clare insists that she will never get married, as she couldn't bear to walk down the aisle without her mother. Touched by Joan and Nat's romance, she decides to be more receptive to the idea of marriage. Kelly befriends Jimmy, a hospice resident with an upbeat attitude. David moves into Mark's luxurious home. He tries to get another video contract after being dropped by MZA, and refuses to help Donna film the wedding. Valerie sees Kenny having lunch with his family and suspects that he has lied about his marital status.

Music: """"Wedding Bell Blues"""" by The Fifth Dimension",https://image.tmdb.org/t/p/original//tDyd2AAuLEGJp1wCor3Vzm1DBSJ.jpg
Disappearing Act,7,4,1996-09-11,10.0,"Kelly helps Jimmy treat a bleeding cut, and panics after getting some of the blood on her hand. The doctor assures her that she cannot contract HIV this way, but she decides to take an AIDS test because of her history of unprotected sex. The test is negative, and Kelly apologizes for shunning Jimmy. The gang watches Jimmy perform a magic show; later that evening, he tells Kelly that he has just a few days to live. David refuses to tell his father that he has dropped out of school, so Donna breaks the news to Mel. Mel issues David an ultimatum: he must finish college or lose all financial support. Brandon and Mark hire a confident young woman as their news anchor. She suffers a panic attack just before the first broadcast. Mark and Brandon try to calm her with a drink, and she ends up getting plastered. Kenny declares his love for Valerie.",https://image.tmdb.org/t/p/original//gwhEXwVjwazAFHO0Zp3KpHiRssp.jpg
Pledging My Love,7,5,1996-09-18,10.0,"Kelly and David take Jimmy to church to celebrate the Jewish New Year. Jimmy becomes very ill the next day and thanks Kelly for her friendship before dying. Donna gives a shy basketball player a makeover to help her get into the Alpha house. She is accepted, but decides to pledge a sorority that is not so elitist. Donna resigns as rush chairperson to protest the behavior of Alpha president Ellen. Steve leads a group of KEG pledges in a Spirit Day prank; they run through Chancellor Arnold's speech wearing nothing but shaving cream, only to have the sprinklers come on. The dean becomes furious when the incident is replayed on the CU News, as she considers it sexual harassment. Chancellor Arnold, with Mark's cooperation, orders Brandon to turn over the tape so that he can identify the offenders. He reluctantly gives the chancellor the tape, which is mysteriously blank. Tracy reveals that she erased the video with a magnet out of loyalty to Steve and Brandon. Kenny rents a love nest for hi",https://image.tmdb.org/t/p/original//3PomLrwddeiQyFcOLzqKOtUWaqz.jpg
Housewarming,7,6,1996-09-25,10.0,"David and Mark throw a big party at their house. Clare catches Steve kissing another girl and dumps him; she is tired of constantly fighting and listening to Steve's apologies. A fire sweeps through the hills and threatens the house. Kelly experiences flashbacks about being burned, but decides to stay and help everyone protect the house. The house is spared because of a shift in the winds. David drinks too much and spends the whole day throwing up. Donna slips and injures her knee while trying to save a baby deer. The firefighters--including hunky Cliff Yeager--rescue Donna and the deer. Kelly accepts a date from the persistent Mark. Valerie comes clean with Brandon about her affair with Kenny; he warns her to break things off. Kenny and his wife finally agree to seek a divorce. Kenny tells Val that he cannot see her for the time being because he does not want to give ammunition to his wife's attorney.

Music: """"Devil",https://image.tmdb.org/t/p/original//57dfWkyCwK7nLhZxr3404qq8O7M.jpg
Fearless,7,7,1996-10-30,10.0,"Kenny orders Valerie to terminate her pregnancy. He agrees to pay her $100,000 to have an abortion. When he skips a meeting where he was to make the payment, she delivers diapers to his befuddled wife. Kenny angrily writes Valerie the check. Firefighter Cliff helps out with the Alphas' haunted house, where he encourages a young boy to overcome his fears. Cliff later has a date with Donna at the After Dark. Steve is miffed when Clare chooses to go to the Halloween concert with egotistical Dick Harrison, a Phi Beta Kappa. He uses an escort service in the hopes of making Clare jealous, but she learns that Steve paid the woman and mistakenly assumes that she is a hooker. Steve turns down Clare's proposal of an open relationship. Brandon and Tracy spend time together at the club, although he does not wish to pursue another workplace romance. He gives her a ride home and kisses her. David refuses to spend the weekend at his grandparents' house in Palm Springs. His father calls him to deliver",https://image.tmdb.org/t/p/original//bH8HDD6lF3GT62wxfLIvkFhb59g.jpg
The Things We Do for Love,7,8,1996-11-06,10.0,"Steve overhears Val discussing her pregnancy on the phone. She begs him to keep her secret, but he shares the news with Kelly. Kelly gives Valerie her full support and offers to drive her to the clinic. Val turns her down, claiming that Kenny will be by her side. Kelly runs into Kenny at a restaurant, and Valerie's conflicting stories prompt Kelly and Steve to suspect that she was never pregnant. David's grandfather leaves him $250,000 and a 1961 Thunderbird. Mel believes that David should keep the money in a trust, and threatens to contest the will. He later backs off, although he and his mother express concern about David's drinking. Steve learns that Clare and Dick are participating in crew. He begins rowing with a group of his frat brothers, and responds to Dick's taunts by challenging his squad to a race. Donna and Cliff become closer. During a day of hiking, he reveals that he is leaving for an out-of-state job. An uncomfortable Tracy decides to quit her TV job after Brandon nixe",https://image.tmdb.org/t/p/original//xYcTptGNuTvDfDb7w26x4kW8sLy.jpg
Loser Takes All,7,9,1996-11-13,9.0,"Kelly takes great delight in telling Brandon about Valerie's pregnancy and abortion, and also shares her doubts about Val's story. Brandon goes to see Kenny, who portrays himself as an innocent victim caught in the web of an evil vixen. He tells Brandon that he paid Valerie $100,000 to stay away. Brandon threatens to throw Val out of the house unless she gives the money back. Valerie plans to move out, but returns the money following a talk with Tracy. She confesses to Brandon that she was never pregnant, and insists that she cannot live up to his moral expectations. Mel, worried by David's newfound wealth, asks Donna to keep an eye on him. David goes on a wild spending spree, and later shows up at Donna's apartment in the middle of the night after swimming in the ocean. David offers to help out the financially strapped Valerie by purchasing half of the club. They celebrate their deal by making out. Steve impresses Clare with his dedication as he trains for the crew race. His team bare",https://image.tmdb.org/t/p/original//w4chNXBC1XPTLOAt05v84KzBOqA.jpg
Lost in Las Vegas,7,10,1996-11-20,0.0,"David takes Valerie, Steve and Clare to Las Vegas for the weekend. He frightens them with his reckless driving. They see Ray perform in concert, and he comments on David's frenzied behavior. David gets drunk and suffers heavy gambling losses. He invites some girls on the street to join him at another casino. The women take David to their motel, where they drug him and steal his money, credit cards, jewelry and clothes. Ray calls Donna and advises her to fly in from Los Angeles. She yells at her friends for not babysitting David, then comforts him. Brandon meets a troubled woman at the Peach Pit; she was robbed just after arriving in town, and cannot get in touch with her fianc. Brandon provides her with refuge, and helps her pick up the pieces when she learns that her fianc has met someone else. Steve steals a term paper from Brandon and turns it in as an independent study project.  Music: """"The Great",https://image.tmdb.org/t/p/original//fjYTYPDejEpCUkRxDU5TyXP90Et.jpg
